"Hi, Super Nintendo Chalmers!",Ralph Wiggum
Eat my shorts,Bart Simpson
Doughnuts? I told you I don't like ethnic food,Mr. Burns
"Oh, wow, windows. I don't think I could afford this place.",Otto
I believe the children are the future... Unless we stop them now!,Homer Simpson
"Hello, Simpson. I'm riding the bus today becuase Mother hid my car keys to punish me for talking to a woman on the phone. She was right to do it.",Principal Skinner
"Hey, I'm the chief here. Bake him away, toys.",Chief Wiggum
